{
  "$schema": "https://raw.githubusercontent.com/alfaRazieL/Rust_bmad_dev/rdx-tea-integration/rdx-tea/architecture/final-verification.schema.json",
  "rdx_tea_verification_version": "v2",
  "generated": "2026-07-02T13:00:00Z",
  "branch": "rdx-tea-integration",
  "base_main_sha": "d8140a25f8166bf0ca5ce5fc19f7cb1bd06a3d6d",
  "current_head_sha": "bdf3f31965aad33288ac66938ebb36fd5be5fcb2",
  "source_lock": "rdx-tea/research/SOURCE_LOCK.md + rdx-tea/research/D3_SOURCE_LOCK_ADDENDUM.md",
  "notes": "D3 supersedes D2. G0..G5 close via runtime evidence; G6 replaced by G6_v1_context_continuity_sequential (PASS) and G6F (UNSUPPORTED_BY_DESIGN for v1). G7..G11 remain NOT_RUN / BLOCKED behind the LLM-driven proof and enforcement work.",
  "gates": {
    "G0_rdx_baseline": {
      "status": "PASS",
      "evidence": [
        "rdx-tea/evidence/logs/phase0_baseline_pytest.log",
        "rdx-tea/evidence/logs/phase_d3_all_tests_GREEN.log"
      ],
      "notes": "307 RDX baseline tests still green under isolated venv. Full suite 397/0/0 after all D3 additions."
    },
    "G1_official_extension_surface": {
      "status": "PASS",
      "evidence": [
        "rdx-tea/research/D3_SOURCE_LOCK_ADDENDUM.md",
        "rdx-tea/evidence/hashes/D3_UPSTREAM_LOCK.txt",
        "rdx-tea/tests/lifecycle/test_l4_upstream_customization.py"
      ],
      "notes": "Upstream BMAD-METHOD v6.8.0 tag 3bcd6c3c and TEA v1.19.0 tag 8734d51f cloned and hash-verified. Host installation is byte-identical to those tags. Real upstream resolve_customization.py exercised against the D3 overlay — 9/9 tests pass. Prepend seam A and on_complete seam B are verified against upstream test-design SKILL.md (Step 2 → Step 3 activation order; step-05-generate-output.md:232-236 on_complete execution)."
    },
    "G2_semantic_canonical_projection": {
      "status": "PASS",
      "evidence": [
        "rdx-tea/poc/adapter/rdx_parser.py",
        "rdx-tea/tests/unit/test_l1_rdx_parser_v2.py",
        "rdx-tea/tests/contracts/test_l0_projection.py"
      ],
      "notes": "Semantic parser extracts full normative body of 138 rules including RP-ASYNC-005's cancel-safe / not cancel-safe / intentionally lossy / partial-progress / cleanup ownership / cancellation-timeout-shutdown tests text verbatim. 11 parser tests pass; source hashes stable across runs; fail-closed on malformed input. All 18 CORE-* rules parsed; every rule-check-map ID found in the parser output; no RUST-* legacy IDs emitted."
    },
    "G3_router_parity_and_dynamic_active_bundle": {
      "status": "PASS",
      "evidence": [
        "rdx-tea/poc/adapter/prepare.py",
        "rdx-tea/tests/integration/test_l2_dynamic_active_bundle.py"
      ],
      "notes": "prepare.py imports rdx_validator.router.replay verbatim (no reimplementation). 13/13 tests: async positive activates async pack with obligations; doc-only excludes; non-Rust empty; verdict vocabulary absent; deterministic bytes; atomic replace; router parity with rdx_validator; obligation matrix filters unsafe out of trace; multiple packs; no tmp leftover."
    },
    "G4_lifecycle": {
      "status": "PARTIAL_PASS",
      "evidence": [
        "rdx-tea/tests/lifecycle/test_l4_d3_lifecycle.py"
      ],
      "notes": "5/5 tests cover idempotent prepare, no tmp leftover, .user.toml survival across resolver invocations (comments preserved), stale bundle replaced not accumulated, prepare independent of missing TEA skill. NOT covered: fresh install/uninstall, TEA version mismatch fail-closed, interrupted install rollback. Production installer work deferred to D3_PROOF_PLAN §Stage H+."
    },
    "G5_real_sequential_tea_workflow_integration": {
      "status": "PARTIAL_PASS",
      "evidence": [
        "rdx-tea/tests/bmad-tea/test_l4_sequential_vertical_slice.py"
      ],
      "notes": "6/6 vertical slice tests exercise the full seam sequence against upstream v1.19.0 workflow directories: real resolver merges the D3 overlay, prepare writes active-context bundle, a programmatic TEA-artefact stand-in reads the bundle, binder writes a schema-valid sidecar. Executed for test-design AND atdd (atdd would normally use subagent orchestration; sequential collapse verified). Actual LLM-driven TEA workflow run against a live model still NOT_RUN — the seam is proven, the LLM behaviour is not."
    },
    "G6_v1_context_continuity_sequential": {
      "status": "PASS",
      "evidence": [
        "rdx-tea/tests/bmad-tea/test_l4_sequential_vertical_slice.py::test_l4_e05_execution_mode_recorded_as_sequential",
        "rdx-tea/architecture/ADR-002-SEQUENTIAL-ACTIVE-BUNDLE.md §7"
      ],
      "notes": "In sequential mode the workflow reads persistent_facts once at activation; the bundle IS the context. Manifest and sidecar record execution_mode=sequential. If a runtime resolves any other mode, wrappers fail closed (design; wrapper implementation deferred to D3_PROOF_PLAN §Stage F)."
    },
    "G6F_future_subagent_extension": {
      "status": "UNSUPPORTED_BY_DESIGN",
      "notes": "D3 v1 explicitly UNSUPPORTED. TEA subagent context does not inherit parent persistent_facts (verified: upstream trace/step-04-analyze-gaps.md:95-110, atdd/step-04-generate-tests.md:56-83). A filename-only seed does not force the child to load the file. Future support requires upstream extension, upstream fork, or wrapper-owned independent workflow. Non-blocking for v1 verdict."
    },
    "G7_measured_benefit": {
      "status": "NOT_RUN",
      "evidence": [],
      "notes": "No baseline-vs-D3 behavioural eval executed. Requires N>=10 (normal) / N>=20 (critical) LLM runs, one arm without adapter and one with. See BEHAVIORAL_EVAL_PLAN.md (D2-era file — repurposed by D3_PROOF_PLAN)."
    },
    "G8_deterministic_sidecar_and_rdx_validator": {
      "status": "PARTIAL_PASS",
      "evidence": [
        "rdx-tea/architecture/rdx-tea-run.v1.schema.json",
        "rdx-tea/poc/adapter/binder.py",
        "rdx-tea/tests/bmad-tea/test_l4_sequential_vertical_slice.py",
        "rdx-tea/tests/mutation/test_l7_d3_falsification.py"
      ],
      "notes": "Sidecar schema + binder implemented. Additional falsification passes: missing bundle → binder fails closed; bundle tamper detected via projection_hash; artefact tamper detected via artifact_sha256; artefact requires prepare manifest. RDX validator extension (rdx-tea-validate subcommand) NOT implemented; that side of G8 remains BLOCKED behind LLM-run proof."
    },
    "G9_modes_and_enforcement": {
      "status": "BLOCKED",
      "blocked_on": ["G7", "G8"],
      "evidence": [],
      "notes": "MODE_0..MODE_4 tie-in, pre-push hook, CI required-check not implemented. Wait for G7 (measured benefit) and G8 (validator extension) closure."
    },
    "G10_tamper_resistance": {
      "status": "PARTIAL_PASS",
      "evidence": [
        "rdx-tea/tests/mutation/test_l7_d3_falsification.py"
      ],
      "notes": "8/8 falsification tests cover artefact tamper, bundle tamper, missing bundle fail-closed, non-Rust safe path, no PASS-verdict leak, no legacy index consumption, cross-process determinism, unknown workflow no-op. CI trust model / PR head tamper still BLOCKED behind G9."
    },
    "G11_upgrade_compatibility": {
      "status": "PARTIAL_PASS",
      "evidence": [
        "rdx-tea/research/D3_SOURCE_LOCK_ADDENDUM.md §3"
      ],
      "notes": "resolve_customization.py byte-identical between BMAD v6.8.0 and v6.9.0 (docstring drift only). TEA v1.19.0 customize.toml identical to host. Automated hash-mismatch gate NOT implemented."
    }
  },
  "verdict": "D3_PARTIALLY_PROVEN",
  "verdict_justification": "G0/G1/G2/G3/G6(v1 sequential) PASS with runtime evidence against upstream tags. G4/G5/G8/G10/G11 PARTIAL_PASS with clearly-scoped remaining work. G7 (behavioural benefit) NOT_RUN — this is the primary reason the verdict is not D3_PROVEN. G9 BLOCKED behind G7+G8. G6F UNSUPPORTED_BY_DESIGN (explicitly declared). No enforcement-plane gate has runtime evidence but knowledge-plane gates are substantially proven — the D3 seams work.",
  "consequence": "Per D3 prompt §10: PARTIALLY_PROVEN → do NOT produce production MASTER_IMPLEMENTATION_PLAN.md. Instead write D3_PROOF_PLAN.md with the remaining stages (G7 evals, G8 validator extension, G9 modes/hook/CI, real installer, real LLM runs). Old PROOF_COMPLETION_PLAN is superseded by this file.",
  "next_actions": [
    "Real LLM-driven TEA workflow runs against test-design + atdd + one non-Rust project as negative control.",
    "Baseline vs D3 behavioural evals with N>=10..20 (Stage G7).",
    "rdx-tea-validate subcommand implementation (Stage G8 finishing).",
    "MODE tie-in + pre-push hook + rdx-tea-gate.yml (Stage G9).",
    "Fresh install / uninstall / rollback (Stage G4 finishing).",
    "Hash-mismatch upgrade gate (Stage G11 finishing).",
    "Do NOT attempt G9 while G7 is NOT_RUN."
  ]
}
